{
  "schema_version": "1.0",
  "provenance_id": "20261022T184852Z-4bc71506",
  "reviewer": "reimth@etik.com",
  "statement": "reviewed-and-tested",
  "attested": "20261022T215234Z",
  "commits": [
    {
      "patch_id": "5a48714e99ad08239f45d0971da65b966d6fc495",
      "subject": "ci: use shared workflow C/C++ Autotools CI v1.0.0"
    }
  ],
  "tests": {
    "command": "python3 -m unittest tools/test_prov.py",
    "exit": 0,
    "log_digest": "sha256:7e0ab604f8d14ad2bb6839742d56257d6f4549147832461aef6b3ae99e39a918",
    "duration_s": 6.958
  }
}
