{
  "schema_version": "1.0",
  "provenance_id": "20261029T221952Z-fbf64e08",
  "reviewer": "thomas.reim@airbus.com",
  "statement": "reviewed-and-tested",
  "attested": "20261030T001449Z",
  "commits": [
    {
      "patch_id": "6bd2653259677802cd2e6b4a096469c11e985f0a",
      "subject": "prov: honest records when the log yields no observation"
    }
  ],
  "tests": {
    "command": "python3.11 -m unittest tools.test_prov",
    "exit": 0,
    "log_digest": "sha256:6b1389fdf40090d7934d8955c1d5cfe5e6a280d3adfa7229005be59179845e71",
    "duration_s": 20.013
  }
}
