{
  "schema_version": "1.0",
  "provenance_id": "20261029T164814Z-85a260cb",
  "reviewer": "thomas.reim@airbus.com",
  "statement": "reviewed-and-tested",
  "attested": "20261030T001449Z",
  "commits": [
    {
      "patch_id": "d79e6090a1f15f4550682b033264c7255f97aa6a",
      "subject": "schema: drop the harness-log sentence and count completion requests"
    }
  ],
  "tests": {
    "command": "python3.11 -m unittest tools.test_prov",
    "exit": 0,
    "log_digest": "sha256:6b1389fdf40090d7934d8955c1d5cfe5e6a280d3adfa7229005be59179845e71",
    "duration_s": 20.013
  }
}
