{
  "schema_version": "1.0",
  "provenance_id": "20261020T204438Z-656ef2f2",
  "reviewer": "reimth@etik.com",
  "statement": "reviewed-and-tested",
  "attested": "20261020T230852Z",
  "commits": [
    {
      "patch_id": "2d29753566fa89628f7c57f720c0a636123caff1",
      "subject": "docs: RFC 0005 Phase 3 research on how model identity reaches a commit"
    }
  ],
  "tests": {
    "command": "python3 -m unittest tools/test_prov.py",
    "exit": 0,
    "log_digest": "sha256:c3568d6b4a9e651ab8f1831b91dbd2ae7c376e7cb8616a5805e89a41a7d32b3b",
    "duration_s": 6.349
  }
}
