{
  "schema_version": "1.0",
  "provenance_id": "20261020T063842Z-fec85dd9",
  "reviewer": "reimth@etik.com",
  "statement": "reviewed-and-tested",
  "attested": "20261020T064332Z",
  "commits": [
    {
      "patch_id": "bead86cc15ed2737829789a5725ab5bf2cec1e1a",
      "subject": "docs: AGENTS.md entry point for AI agents, imported by CLAUDE.md"
    },
    {
      "patch_id": "cb08161436840aacd7bf072a0373534186369f0d",
      "subject": "ci: schema-validate.yml to actions/checkout v5, as on main"
    }
  ],
  "tests": {
    "command": "python3 -m unittest tools/test_prov.py",
    "exit": 0,
    "log_digest": "sha256:50bd5bedff830ad4ddf1fe31f5b88666b9be5620129ebe087d6d97de0bdaf31a",
    "duration_s": 6.625
  }
}
