{
  "schema_version": "1.0",
  "provenance_id": "20261029T085419Z-71d59f10",
  "reviewer": "thomas.reim@airbus.com",
  "statement": "reviewed-and-tested",
  "attested": "20261030T001449Z",
  "commits": [
    {
      "patch_id": "a5d0b10277fe40423dae63cae71c785fa195e1d7",
      "subject": "prov: address PR #178 review on capture evidence"
    }
  ],
  "tests": {
    "command": "python3.11 -m unittest tools.test_prov",
    "exit": 0,
    "log_digest": "sha256:6b1389fdf40090d7934d8955c1d5cfe5e6a280d3adfa7229005be59179845e71",
    "duration_s": 20.013
  }
}
