{
  "schema_version": "1.0",
  "provenance_id": "20261028T225246Z-83ed1301",
  "reviewer": "thomas.reim@airbus.com",
  "statement": "reviewed-and-tested",
  "attested": "20261030T001449Z",
  "commits": [
    {
      "patch_id": "15eaf5c6c40fcc9dcf514b08f241a394cba3c3ab",
      "subject": "prov: capture evidence, observed[], schema v2 dispatch"
    }
  ],
  "tests": {
    "command": "python3.11 -m unittest tools.test_prov",
    "exit": 0,
    "log_digest": "sha256:6b1389fdf40090d7934d8955c1d5cfe5e6a280d3adfa7229005be59179845e71",
    "duration_s": 20.013
  }
}
