{
  "schema_version": "1.0",
  "provenance_id": "20261029T155928Z-1ba670a9",
  "reviewer": "thomas.reim@airbus.com",
  "statement": "reviewed-and-tested",
  "attested": "20261030T001449Z",
  "commits": [
    {
      "patch_id": "49ff3d4cd756c3096e3520f960a2dcbd6c059a0f",
      "subject": "prov: address PR #178 round-3 review on capture evidence"
    }
  ],
  "tests": {
    "command": "python3.11 -m unittest tools.test_prov",
    "exit": 0,
    "log_digest": "sha256:6b1389fdf40090d7934d8955c1d5cfe5e6a280d3adfa7229005be59179845e71",
    "duration_s": 20.013
  }
}
